{
  "schema_version": 1,
  "proposal_id": "meabeclickeng-test-driven-development-51414605",
  "profile": "meabeclickeng",
  "skills": ["test-driven-development"],
  "approved_by": "Lior",
  "approved_at": "2026-10-25T00:28:00+03:00",
  "manifest_commit": "80acfdec871514d5cd3c0d16d36dfb54001768b8"
}
