{
  "schema_version": 1,
  "proposal_id": "meabeclickgrowth-social-media-content-calendar-0319e113",
  "profile": "meabeclickgrowth",
  "skills": ["social-media-content-calendar"],
  "approved_by": "Lior",
  "approved_at": "2026-10-25T00:28:00+03:00",
  "manifest_commit": "80acfdec871514d5cd3c0d16d36dfb54001768b8"
}
